url,title,path,text
https://theonion.com/i-d-like-the-crispy-chicken-sandwich-first-truthful-t-1819579685/,‘I’d Like The Crispy Chicken Sandwich’ First Truthful Thing Man Has Said In Weeks,"","ABILENE, TX—In a sudden and surprising moment of candor, local man Brett Hutchings told a Wendy’s cashier Friday “I’d like the Crispy Chicken Sandwich,” reportedly the first truthful statement the 30-year-old has uttered in weeks. “Let me get some fries with that too, please?” Hutchings said, opening up and revealing his frank, unvarnished feelings in a way he has not in approximately 24 days. “And a small—no, make that a medium—vanilla Frosty.” Moments later, Hutchings stated his meal was to-go, which, according to sources, will be the last time he expresses himself genuinely until selecting pizza toppings a full three months from now."
https://theonion.com/area-man-accepts-burden-of-being-only-person-on-earth-w-1819579668/,Area Man Accepts Burden Of Being Only Person On Earth Who Understands How World Actually Works,"","INDIANAPOLIS—Solemnly declaring that he alone could enlighten a human race crippled by ignorance, area man Aaron Krause said Thursday that he had accepted the burden of being the only person on earth who actually understands the world and how it works.
Krause, a 41-year-old sales manager and father of two, told reporters that his unequaled comprehension of politics, technology, popular culture, interpersonal relationships, food, sports, and all other existing subjects brings with it a heavy obligation to share all he knows with the countless individuals everywhere who remain totally in the dark.
“Being the only one who knows everything isn’t an easy cross to bear, but simply put, I have a responsibility to tell people when they’re wrong,” said Krause, adding that despite an initial reluctance to impart his singular wisdom, he ultimately accepted it as his duty. “It’s not their fault, but I’m still going to correct them for their own benefit—maybe next time they’ll know the right way to run a meeting, lose weight, or listen to music.”
“If I don’t help these people, who else can?” he added.
Krause explained that he began to grasp the full scope of his burden after being repeatedly taken aback by the profound misunderstanding family and friends displayed about everything from selecting retirement savings accounts to disciplining children to properly grilling a steak. It was only after years of listening to people voice their shocking misconceptions about workplace etiquette, taxes, the relative merits of various makes and models of cars, and common grammar mistakes did Krause reportedly realize that he was the only living person endowed with such knowledge and that no one anywhere understood the world as unerringly as he did.
According to Krause, his duty to enlighten the other 7.4 billion inhabitants of the planet follows him wherever he goes. Whether he is eating dinner at a restaurant with his family, walking through the breakroom at work, or spending time with friends, he told reporters that he must always be ready to rise to the occasion, imparting at a moment’s notice insights regarding what makes a good movie, whether a particular football player should be traded, or the superiority of certain rideshare apps over others.
Conceding that his unmatched knowledge often makes it difficult to be patient with the uninformed multitudes, Krause added that he is frequently put in a position where he has no alternative but to interrupt a conversation among individuals he has never met.
“I was at a party last week, and these people nearby obviously hadn’t the faintest notion of who made the best burger in town, so I had to spend an awful lot of time breaking it down for them,” Krause said, adding that he had similarly educated other guests at the same gathering on the best time to give children their own smartphone and the appropriate method for battling international terrorism. “And it’s even harder when I go on social media. There, I’m just bombarded with people who are completely mistaken about everything, and it feels like I’ll never get to everyone who needs my help.”
“But I have to try,” he added. “This is the weight I carry.”
Well aware that he had no choice but to speak up, Krause was at press time explaining to a stranger that the book she was reading wasn’t nearly as good as several others on the topic."
https://theonion.com/87-of-loud-crashing-noises-are-nothing-report-top-exp-1819579684/,"87% Of Loud Crashing Noises Are Nothing, Report Top Experts From Other Room","","WASHINGTON—Insisting to the nation that it’s totally fine in there and that they definitely don’t need any help, the country’s top experts from the other room reported Friday that 87 percent of loud crashing noises are nothing.
Speaking in muffled voices audible from the other side of the wall, the experts confirmed that nearly nine in 10 of these sounds—which included thuds, bangs, and a crash followed by a pause and then several smaller crashes in quick succession—honestly aren’t anything at all.
“Not a thing to worry about,” the experts said almost instantaneously after a loud clatter suddenly rang out from the adjacent room. “It’s okay.”
“Everything’s okay,” they added.
Despite initially reporting “Dammit!” and “God dammit!” separated by several seconds, experts from the other room emphasized that all such preliminary statements should now be entirely disregarded, because the situation is, in fact, completely fine. They went on to clarify that it’s really not a big deal at all and any exasperated groans overheard from the other room should just be ignored.
According to the experts, who spoke over the sound of something in the other room shattering, 37 percent of the noises aren’t anything you need to concern yourself with, 29 percent are no problem whatsoever, and the remaining 21 percent are not nearly as bad as they just sounded.
In 100 percent of cases, the other-room experts said everything is cool and there is absolutely no reason to get up.
Sources stated that the crashing noises from the other room were often followed by a number of quieter sounds, including what seemed to be a series of rapid footsteps and the scraping of an object being dragged across the floor.
“Being taken care of,” said the other-room experts. “Yeah, no, it’s fine. Just stay where you are. Just stay in there.”
At press time, the clamor had stopped, and after a minute of silence, the experts in the other room overwhelmingly determined that they were so completely fucked."
https://theonion.com/salad-suppliers-pledge-to-continue-including-just-enoug-1819579707/,Salad Suppliers Pledge To Continue Including Just Enough In Bag That Some Will Go Bad If You’re Single,"","SALINAS, CA—In an effort to maintain stringent industry standards, salad suppliers nationwide pledged Monday to continue including just enough greens in bagged salad so that some will go bad if you’re single. “Whether it’s our 50/50 Mix or a simple chopped romaine, single customers can rest assured that they will always be left with a slimy, inedible clump of brown leaves at the bottom of the bag that wouldn’t be there if someone else were in their lives,” said Fresh Express CEO Marc Driver, adding that salad producers were united in ensuring that the refrigerators of partnerless consumers always contained a folded-over bag of soggy, spoiled vegetable matter that forces them to contemplate the possibility they’ll be alone forever. “You’ll know we’ve upheld our end of the bargain when you toss that quarter-filled container of rotting salad in the trash and wish you had someone—anyone—who you could come home to every night.” The suppliers also reaffirmed their commitment to including just the right amount of salad in their Spring Mix for couples in loveless relationships to always have their mouths full and eat in total silence."
https://theonion.com/high-school-band-teacher-spends-85-of-rehearsal-hammer-1819577272/,High School Band Teacher Spends 85% Of Rehearsal Hammering In Dress Code For Holiday Concert,"","SAN JOSE, CA—Emphasizing the importance of his instructions by raising his voice and repeating crucial points, Leland High School band teacher Jeff Amos reportedly spent 85 percent of Friday’s rehearsal hammering in the dress code for the school’s upcoming holiday concert. “It’s black turtlenecks with full-length sleeves, and they will stay tucked in for the entire time, do I make myself clear?” said the 54-year-old music instructor during a 25-minute aside that stressed how deviations from the protocol, such as wearing sneakers—even the black sneakers that many tried to get away with last year—would land them backstage for the entire performance. “Girls, skirts must be past your knees. And boys, I expect slacks; gray-colored jeans aren’t going to cut it. Under those stage lights, every single person in that auditorium will see you sticking out like a sore thumb. Got it?” At press time, Amos was reportedly keeping everyone in the band room for an extra 10 minutes to drive home how disappointed he would be if, after so many reminders, anyone forgot their Santa hat for the closing performance of “Jingle Bell Rock.”"
https://theonion.com/man-s-family-rises-to-record-high-fourth-priority-1819577274/,Man’s Family Rises To Record-High Fourth Priority,"","WALTHAM, MA—After years of its climbing no higher than the ninth slot, sources confirmed Friday that area man Alan Stokes’ family rose to the 48-year-old’s record-high fourth priority. “It’s really impressive to see Emily and the kids suddenly vault into the top five of what matters to him in life,” said a source close to the family, adding that no one foresaw Stokes’ desire to take care of his wife and twin daughters grabbing the coveted fourth spot ahead of longtime preoccupations such as fishing or watching poker tournaments on television. “But it’s going to be really tough for them to hold on to the position if he gets the promotion or buys that new motorcycle—the family could really take a tumble.” Sources added that Stokes’ family would only crack the top three in the highly unlikely event he got a handle on his drinking."
https://theonion.com/phone-call-with-dad-just-watered-down-version-of-phone-1819577277/,Phone Call With Dad Just Watered-Down Version Of Phone Call With Mom,"","CHARLOTTE, NC—Progressing swiftly through the same topics but in far less detail, local man Ian Miller’s four-minute phone call with his father Monday was reportedly just a watered-down version of the conversation he’d had moments earlier with his mother. “You know, work’s going pretty well—can’t complain,” said Miller during the pared-back exchange, before delivering a condensed, two-sentence update on the status of his long-term relationship that elicited no follow-up questions or lengthy asides. “Yep. I’m excited about being home for Christmas, too.” According to sources, Miller ended the call by telling his dad he’d talk to him again real soon, scaling back the “love you, too” he’d used to end the conversation with his mother."
https://theonion.com/man-somehow-thinks-he-doesn-t-have-enough-alone-time-1819577280/,Man Somehow Thinks He Doesn’t Have Enough Alone Time,"","MINNEAPOLIS—Making repeated claims this week that he could really use a break from being around people, local copywriter Jonathan Maynard has, by all accounts, somehow come to the conclusion that he does not have enough alone time in his life. “I wish I could carve out a little extra time during the day that’s just for me,” said the 28-year-old, who, despite having few serious demands on his schedule and regularly spending his evenings and entire weekends alone either browsing online or watching television, openly wishes for more time by himself. “All I need is a few uninterrupted hours away from everyone else when I can just decompress and focus on my personal interests. Is that too much to ask?” At press time, Maynard was reportedly canceling a prior social engagement in order to finally catch up on an Assassin’s Creed game he had been putting off for several days."
https://theonion.com/teen-sick-of-mother-barging-into-room-with-clean-folde-1819577305/,"Teen Sick Of Mother Barging Into Room With Clean, Folded Clothes","","ELIZABETHTOWN, PA—Voicing displeasure at her blatant disregard for his privacy, area teenager Chad Fleming reported Wednesday that he is fed up with his mother always barging into his room to put away freshly washed laundry. “Jesus, Mom! Why can’t you just respect my personal space?” a visibly angered Fleming told his mother, who entered his bedroom unannounced carrying a basket full of clothes that she had spent the previous two hours separating by color, washing, and neatly folding. “Is it so hard to knock? God, you never let me be.” At press time, Fleming was livid at his mother for once again violating his privacy to remove a pile of dirty dishes."
https://theonion.com/family-receives-38-piece-astrazeneca-assorted-pill-samp-1819577299/,Family Receives 38-Piece AstraZeneca Assorted Pill Sampler,"","ALPHARETTA, GA—Gathering around the kitchen table to pick out their favorites, all four members of the Johnson household eagerly dug into a 38-piece AstraZeneca pill sampler that they received as a holiday gift, sources confirmed Friday. “I like the blue-and-red ones a lot, but I’ll pretty much eat any of them except for the yellows; I always leave those for Dad,” said 12-year-old Evan Johnson, who added that out of the box’s assorted painkillers, decongestants, estrogen supplements, and antipsychotic medications, he enjoys the ones with a codeine-based gel filling the best. “It’s also kind of fun to grab one without knowing what’s inside and try to guess what you’ve taken. Last year, I got a beta blocker and it was really gross, though, so maybe I’ll just look at the little guide and only pick out the good ones.” At press time, each of the family members had reportedly taken too many pills and was complaining of stomach discomfort, dizziness, and blurred vision."
https://theonion.com/mom-gathers-rolls-of-wrapping-paper-around-her-to-strok-1819577311/,Mom Gathers Rolls Of Wrapping Paper Around Her To Stroke Softly,"","‘Not Much Longer, My Pets’
OAKWOOD, OH—Tenderly cooing as she basked in the comforting sight of snowman, Santa, and Christmas tree patterns, local mother Melissa Weaver surrounded herself with a dozen rolls of wrapping paper to softly stroke, sources confirmed Friday. “Yes, my darlings, the time is near,” said Weaver, gently running her fingers through strands of red, green, and silver ribbon. “It won’t be long now. Patience, little ones, patience.” Weaver then reportedly gave a light kiss to one of her large fabric bows before returning her supplies to the closet and quietly shutting the door."
https://theonion.com/family-knows-better-than-to-fall-for-mom-s-little-bulls-1819577302/,Family Knows Better Than To Fall For Mom’s Little Bullshit Speech About No Presents This Year,"","RICHMOND, VA—Saying that several of them had learned the hard way, members of the Gordon family confirmed to reporters Friday that they knew damn well not to believe Mom’s little bullshit speech about not giving gifts this Christmas. “She doesn’t mean a goddamn word of it,” said Alex Gordon, 32, one of Ellen Gordon’s three adult children, all of whom agreed that you’d have to be pretty fucking thick if you didn’t see right through her little song and dance about just enjoying each other’s company without the expense and obligation of giving presents. “She says this every year, but forget that—of course she wants to do gifts. Can you imagine the look on her face if there actually wasn’t anything under the tree and we just sat around empty-handed like a bunch of assholes? No way is that happening.” Gordon added that he and his siblings were taking their mom’s suggestion that they could leave on Christmas Day if the ticket was cheaper for the utter horseshit that it is."
https://theonion.com/seasonal-depression-kicks-in-just-in-time-to-numb-woman-1819577303/,Seasonal Depression Kicks In Just In Time To Numb Woman Before Holiday With Family,"","PORTLAND, ME—Appreciating the onset of listlessness and despondency, local woman Wendy Fletcher confirmed Tuesday that seasonal depression kicked in just in time to render her emotionally numb before spending Christmas with her family. “When my parents picked me up at the airport and started questioning me about my personal life, I was already completely disengaged with the world around me, so the timing was perfect,” said Fletcher, adding that the seasonal affective disorder was going strong enough that she should be able to spend the next four days in a state of emotional detachment, dulled to the words and actions of relatives. “Last year, seasonal depression didn’t do a number on me until January, so I went through the entire holiday season as an active participant, taking on the full emotional brunt of dealing with family members. Thankfully, that cold snap last week really put me in a funk, and now I should be able to just sleep through most of my visit.” Fletcher added that, with any luck, her emotional paralysis would last long enough this year to get her through another Valentine’s Day alone."
https://theonion.com/first-holiday-season-without-grandma-incredible-1819577307/,First Holiday Season Without Grandma Incredible,"","MARBLEHEAD, MA—Expressing appreciation for the more relaxed and cheerful atmosphere, members of the Shaw family confirmed Thursday that the first holiday season without grandmother Ethel Shaw had been absolutely incredible. “Sure, we miss Grandma and all, but it’s been pretty great this year without her sitting in the corner looking totally miserable while the kids open presents,” said grandson Kyle Shaw, 31, adding that not having to watch his 89-year-old grandmother struggle to swallow candied yams or help her hobble to the bathroom had made this year’s celebration more festive and carefree. “We can finally have conversations without slowing down and repeating everything for her. Plus, when we finish eating, we can just head out to a movie theater. No dropping Grandma off at her retirement home on Christmas night, which always put a damper on things. Frankly, the past few days have been amazing.” Shaw told reporters that everyone in the family had been in such good spirits that they barely even remembered that their grandmother was gone."
https://theonion.com/uncle-put-more-thought-than-usual-into-this-year-s-gift-1819577308/,Uncle Put More Thought Than Usual Into This Year’s Gift Cards,"","HERSHEY, PA—Noting the unprecedented display of effort, Harrington family sources confirmed Thursday that Uncle Jeff put a lot more thought than usual into the gift cards he bought for everyone this Christmas. “Wow, he really must have spent a lot of time at Target picking out just the right prepaid gift card for every member of the family,” said niece Tamara Harrington, adding that it was a vast improvement over last year, when the entire family received $10 gift cards to Ruby Tuesday. “It seems like he actually thought about things that we like. He knows I enjoy reading, so he got me a Barnes & Noble gift card. And he got my younger brother a Best Buy gift card, because he’s really into computers, video games, and that stuff. He just gave my sister a generic Visa gift card, but she’s always been hard to shop for.” Sources confirmed that Uncle Jeff also showed an unheard-of attention to detail this year by bringing a tub of Cool Whip to go along with the store-bought pumpkin pie that he contributed to Christmas dinner."
https://theonion.com/sudden-burst-of-confidence-not-sure-where-the-hell-it-c-1819577317/,Sudden Burst Of Confidence Not Sure Where The Hell It Came From Either,"","SACRAMENTO, CA—Taken aback by the seemingly random nature of its appearance this afternoon, the sudden burst of confidence that overtook local office worker James Greenbaum told reporters that it was not sure where the hell it came from either. “It’s crazy—one minute I’m nowhere to be found, then the next I’m sprouting up from deep within James’ psyche. Needless to say, I was just as baffled as he was,” said the temporary feeling of poise and determination, adding that it had very limited experience with Greenbaum in the past and was both surprised and a bit uncomfortable to find itself inside the 30-year-old junior data management associate. “James was just minding his own business, and then—boom—I show up making him, of all people, feel fearless and self-assured. I don’t think either of us can make any sense of this one.” The burst of confidence added that it would do everything in its power to never return to Greenbaum again."
https://theonion.com/usha-vance-forces-smile-after-unwrapping-another-bible-for-christmas/,Usha Vance Forces Smile After Unwrapping Another Bible For Christmas,"","WASHINGTON—In response to her husband Vice President JD Vance beaming with excitement as she opened his Christmas gift to her, second lady Usha Vance reportedly forced a smile Thursday after unwrapping another Bible. “Oh, wow, another King James Bible, you shouldn’t have,” said Vance, placing the Christian religious text on a large stack of Old and New Testament translations her significant other had given her over the years. “I have some Vedas I’ve been meaning to read first, but I can’t wait to get to all of these Bibles soon. Oh, and it comes with a rosary. Yay.” At press time, Vance expressed some relief that it was another Bible and not “another fucking copy of Hillbilly Elegy.”\n\n\n\n"
https://theonion.com/images-of-national-parks-replaced-with-trumps-face-on-annual-passes/,Images Of National Parks Replaced With Trump’s Face On Annual Passes,"","The Interior Department announced plans to replace a picturesque image of Glacier National Park on the 2026 “America the Beautiful” pass with President Trump’s face, prompting a lawsuit from an environmental group. What do you think?
“At least we know the national parks will be around for one more year.”
“What’s nature without Donald Trump glaring at you?”
“Have you seen his centerfold in the IRS Tax Guide?”"
https://theonion.com/bullshit-newborn-not-even-christ/,Bullshit Newborn Not Even Christ,"","READING, PA—Saying the snot-nosed brat sure as hell better not expect any damn frankincense or myrrh, sources confirmed Friday that a bullshit newborn wasn’t even Jesus Christ, the Son of God. “There’s not a fucking chance this useless goddamn baby is going to die for our sins,” said the child’s uncle Brandon Lowrey, explaining that beyond being born in a hospital instead of a manger, the absolute disgrace of an infant wasn’t actually a boy at all, but in fact a girl. “I bet this little shit isn’t even related to God, let alone a direct relative. I should have known when I didn’t see a single Star of Bethlehem shining above that twerp to beckon wise men from the East. That dumbass baby couldn’t redeem a ham sandwich.” Lowrey added that the good-for-nothing child’s mother was no virgin either."
