url,title,path,text
https://theonion.com/what-to-know-about-trumps-board-of-peace/,What To Know About Trump’s Board Of Peace,"","President Donald Trump signed the charter for his “Board of Peace” Thursday, establishing himself as presiding chairman of a new international body aimed at resolving global conflicts. The Onion shares everything you need to know about the organization.
Q: What is the board’s stated aim?
A: To finally end the impending threat of global cooperation.
Q: What is the organization’s first order of business?
A: To stabilize real estate markets in conflict-affected areas.
Q: How does one become a member?
A: Paying the $1 billion fee for permanent membership and submitting letters of recommendation from three different war criminals.
Q: Which countries have declined to join?
A: A handful of soon-to-be U.S. colonies.
Q: Can any sort of Board of Peace expect to be taken seriously without the inclusion of former British Prime Minister Tony Blair?
A: Don’t worry, he’s part of it!
Q: Will Israel join?
A: It would be rude to finish bulldozing Gaza without them.
Q: What will happen to the countries who do not participate?
A: They will be dealt with by the Board of War.
Q: Does the charter really make Trump chairman for the rest of his life?
A: Yes, Trump will remain chairman for the next few months.
Q: What would be the consequences of replacing the United Nations?
A: A 3% decrease in New York City traffic."
https://theonion.com/peter-barnell/,Peter Barnell,"","Services for Peter Barnell, 72, will be held Friday. The family asks that each attendee take home a portion of the remains because they don’t want any leftovers."
https://theonion.com/sean-mcdermott-expresses-gratitude-to-the-people-if-you-want-to-call-them-that-of-buffalo/,"Sean McDermott Expresses Gratitude To The People, If You Want To Call Them That, Of Buffalo","","BUFFALO, NY—Giving thanks for the hospitality shown to him and his family throughout his tenure with the team, recently terminated Buffalo Bills head coach Sean McDermott reportedly expressed his gratitude Monday to the people, if you want to use that term, of Buffalo. “For the past nine years, the people—and of course I use that word very loosely—of Buffalo have opened their city to me and my wife and children, and for that, these…inhabitants…will forever be in my heart,” McDermott wrote in an emotional, full-page advertisement taken out in The Buffalo News, thanking the city’s vaguely humanoid population for their off-putting approximations of passion and support, and praising them as a group of individuals who perhaps qualify as a community by the slimmest of margins. “It’s been such a privilege to serve these… Again, ‘people’ isn’t quite right, not at all. Anyone watching them lurch around a tailgate can tell you that. ‘Creatures’ would be a more accurate description, I guess, or maybe even ‘organisms.’ But whatever they are, I’ll never forget them.” Though McDermott has yet to formally interview for any of the numerous NFL coaching vacancies, sources close to the coach confirmed that he was open to living among the frothing, subhuman pig-men of Cleveland."
https://theonion.com/thats-norway-to-treat-a-lady/,That’s Norway to Treat a Lady,"",This field is for validation purposes and should be left unchanged.
https://theonion.com/canned-tuna-recalled-for-potentially-fatal-botulism-mistakenly-reshipped/,Canned Tuna Recalled For Potentially Fatal Botulism Mistakenly Reshipped,"","Previously quarantined cans of yellowfin tuna that were recalled due to a defective pull tab which could introduce botulism, a potentially fatal form of food poisoning, were mistakenly reshipped to stores in at least nine states. What do you think?
“Nothing a 10% discount can’t fix.”
“How potentially fatal are we talking?”
“Some poisonings are just meant to be.”"
https://theonion.com/police-ask-for-publics-help-in-falsifying-report/,Police Ask For Public’s Help In Falsifying Report,"",This field is for validation purposes and should be left unchanged.
https://theonion.com/rams-seahawks-game-preempted-by-everybody-hates-chris-rerun/,Rams-Seahawks Game Preempted By ‘Everybody Hates Chris’ Rerun,"",This field is for validation purposes and should be left unchanged.
https://theonion.com/trump-boys-put-nobel-peace-prize-in-microwave/,Trump Boys Put Nobel Peace Prize In Microwave,"","WASHINGTON—Checking to see if the prestigious award was real by placing the medal on the glass turntable and hitting the potato button, Eric Trump and Donald Trump Jr. reportedly microwaved the 2025 Nobel Peace Prize on Friday. “Look, look, I think it’s starting to melt!” said Don Jr., the eldest Trump boy, who pressed his face against the door of the appliance to watch the gold medal slowly rotate as his younger brother begged for his turn to watch. “Bye, bye Abraham Lincoln! We’re going to turn you into slime, and then the Hotel Prize in Appliance [sic] will be ours. Wait, what’s happening?” At press time, sources reported the sobbing Trump boys were telling their father they had no idea how the Nobel Prize got into the fiery microwave."
https://theonion.com/nothing-ever-good-enough-for-captive/,Nothing Ever Good Enough For Captive,"","OVERLAND PARK, KS—Expressing frustration that his efforts to be accommodating continue to go unappreciated, area man Thomas Kemps confirmed Monday that nothing is ever good enough for the woman he has been holding captive in his basement for the past 39 days. “I give and I give, and what do I get in return? Not a single genuine thank-you,” said Kemps, explaining that he has provided the bound and gagged woman with a perfectly good mattress from the alley and the most expensive rope available at the hardware store, but she still finds things to complain about. “I work day and night to put dog food on the floor for her, and she gives me nothing but attitude and entitlement. First, she asks for a special bucket so she won’t have to shit in the corner, and then I have to hear her whine on and on about how the bucket is full. Oh, I’m sorry, I didn’t realize the Uber passenger I drugged and abducted was a princess. Seriously, I’m bending over backwards to help this girl out, and yet she still attempts to slash me in the face with a shard of broken glass. Just a totally ungrateful hostage.” At press time, Kemps was relieved to report that simply threatening to murder the woman’s children had really helped reset the tone of their relationship."
https://theonion.com/entire-french-populace-moved-to-tears-by-cartoon-of-robot-holding-flower/,Entire French Populace Moved To Tears By Cartoon Of Robot Holding Flower,"","PARIS—Clutching their chests in wonder at the newly unveiled work by an anonymous street artist, all 68 million members of the French populace were reportedly brought to tears Friday by a cartoon of a robot holding a flower. “Technology has made us into zombies, and yet here is a robot showing us the truth,” said 43-year-old Clémence Lefèvre, echoing the sentiment of the entire French populace, whose economy ground to a halt as millions of police officers, nannies, mimes, pastry chefs, priests, and rebellious beatniks alike abruptly stopped their affairs to march down the Champs-Élysées and raise their voices as one to thank the robot. “This work is, how do you say…transcendent. It expresses an emotion beyond love and despair, for it is a reflection of love and despair itself. It is subversive like the art of Marcel Duchamp, and yet universal, speaking to all who suffer from ennui and an addiction to their phone. This is better than any work in that bourgeois temple of uninspired slop, the Louvre. Mon Dieu, what have we done to Mother Earth?” At press time, an elderly farmer in a horse-drawn wagon was reported to have rolled up to the cartoon, wordlessly placed his hand on the robot’s heart, and collapsed into a peaceful death."
https://theonion.com/onus-of-giving-parents-grandchildren-placed-on-least-fucked-up-sibling/,Onus Of Giving Parents Grandchildren Placed On Least Fucked-Up Sibling,"","DENVER—Acknowledging the grim reality of their underwhelming romantic prospects, chronic disorganization, and lackluster employment outlook, the adult Patterson children confirmed Friday that the onus of giving their parents grandchildren had been placed on the least fucked-up sibling. “At least Liz has a job and lives in her own apartment,” said oldest sibling Matthew Patterson, adding that his younger sister was the only child without a criminal record or suffering from a crippling addiction to drugs or alcohol. “I’m pretty sure Liz even has health insurance. Tyler lives in a total fucking shithole with like eight roommates. Every surface is covered in empty beer bottles and overflowing ashtrays. That’s no place for a child, not even the total dud that Tyler would probably father. Honestly, Liz is the only one who would probably stick around to raise the kid. Plus, she’s actually been in a relationship that lasted longer than a drunken one-night stand. She definitely has what it takes to become a shitty parent.” At press time, Liz Patterson was reportedly borrowing money from her parents to pay for an abortion."
https://theonion.com/woman-throws-self-on-grenade-by-answering-call-from-dysregulated-friend/,Woman Throws Self On Grenade By Answering Call From Dysregulated Friend,"","MILFORD, MA—Wincing at the blast of guttural sobs erupting from the speaker as she picked up, local woman Anna Higgins reportedly threw herself on a grenade Tuesday by answering a phone call from her dysregulated friend. “I’m so sorry, Jennifer—it must be really hard to get dumped so soon after you stopped taking your antidepressants,” said Higgins, who immediately regretted answering the phone despite it being her turn to act as a human shield between her friend group and the highly unstable woman said to be capable of inflicting severe distress over a wide impact radius with her drama. “Oh wow, I can’t believe how many problems you have in all areas of your life. The other people are the crazy ones. It’s definitely not you! And sure, attempting to get back together with the guy who once stole and crashed your car sounds like a great idea.” At the end of the multihour conversation, sources confirmed that an exhausted Higgins again put herself directly in the line of fire by asking her dysregulated friend if she’d like to meet up for dinner soon."
https://theonion.com/disney-exec-reminds-toddler-only-ip-goes-on-fridge/,Disney Exec Reminds Toddler Only IP Goes On Fridge,"","BURBANK, CA—Encouraging the child to explore the conglomerate’s vast catalog of characters and copyrights, Disney executive John Ervin reminded his 2-year-old daughter on Monday that only artwork featuring the company’s intellectual property was permitted on the fridge. “That’s very creative, Edie, but unfortunately it has no existing fan base,” said the 49-year-old Ervin, who handed the toddler back the drawing of a colorful, octopus-like creature she had presented him with and tried to explain the financial reality of the motion picture industry in terms he thought she could understand. “I sure hope this blue guy over here is Stitch or a Na’vi, because Daddy doesn’t own the rights to the Smurfs. Come on, don’t you want to draw Anna and Elsa? Or what about something from 20th Century Studios? Do you want to draw a FernGully reboot, pumpkin?” Ervin went on to say, “No, Mommy isn’t IP either.”"
https://theonion.com/katy-perrys-friends-skeptical-of-alleged-powerful-boyfriend-who-lives-in-canada/,Katy Perry’s Friends Skeptical Of Alleged Powerful Boyfriend Who Lives In Canada,"","LOS ANGELES—Saying they wished she would just be honest with them, friends of multiplatinum recording artist Katy Perry expressed skepticism this week about her alleged powerful boyfriend who lives in Canada. “Katy keeps going on and on about this new guy, but every time one of us asks when we’ll get to meet him, she just says he’s a really important person in Canada,” said friend Emily Curry, who noted that she first became suspicious after she asked Perry to see a photo of her new beau and was shown a picture that looked suspiciously like it had been pulled from Google images. “I called her last week, and she tried telling me the connection was bad because she and her boyfriend were out on a yacht. Sure, Katy. I don’t know why she feels the need to lie. This is just like when she came back from vacation and told us she had been singing in outer space.” Curry added that the alleged Canadian boyfriend was almost as far-fetched as Perry’s so-called “movie star” ex, who supposedly lives in England."
https://theonion.com/artist-profile-aap-rocky/,Artist Profile: A$AP Rocky,"","Rapper A$AP Rocky has released Don’t Be Dumb, his first album in eight years. The Onion shares everything you need to know about the artist.
Genre: Brand collaboration
Famous Relatives: Rihanna’s kids
Biggest Career Risk: Nodding off during Smurfs premiere
Citations From Massachusetts Department Of Fish And Game: Three
Personal Style: Businessman who sprinted through a silk scarf store
Favorite Thing To Do On Phone: Press “1” to confirm Rihanna’s ob-gyn appointment
Recurring Nightmare: Looking down and realizing he showed up to the Met Gala completely naked
Review Of Sweden: Good food, weird locals, three stars"
https://theonion.com/ice-deems-being-in-privacy-of-own-home-obstruction-of-justice/,ICE Deems Being In Privacy Of Own Home Obstruction Of Justice,"","WASHINGTON—Warning that any attempt to spend time inside a personal residence constituted hostile interference with federal operations, Immigration and Customs Enforcement officials announced Thursday that being in the privacy of one’s own home would now be deemed an obstruction of justice. “When an individual enters their residence, conceals themselves behind a closed door, and attempts to go about their everyday life, they are willfully impeding the important work of law enforcement officers and engaging in domestic terrorism,” said Department of Homeland Security spokesperson Tricia McLaughlin, adding that the agency had updated internal guidelines to classify such aggressive forms of noncompliance as standing around in one’s kitchen, asking why agents are there, or harboring loved ones around a dinner table as Class D felonies. “We will not tolerate any walls, floors, or ceilings that keep public servants from performing their official duties. Moving forward, anyone who commits acts of domestic seclusion will be regarded as a criminal and prosecuted to the fullest extent of the law.” McLaughlin went on to encourage families to gather in their driveways for easier arresting and processing."
https://theonion.com/democrats-condemn-ice-for-murdering-without-proper-warrants/,Democrats Condemn ICE For Murdering Without Proper Warrants,"","WASHINGTON—In a statement calling for more guardrails around ongoing immigration operations, Democrats in the U.S. House of Representatives publicly condemned Immigration and Customs Enforcement Thursday for routinely employing fatal use of force without obtaining the proper warrants. “For weeks, Democrats have pushed to require ICE agents to obtain the necessary judicial warrants ahead of any murders they plan to commit,” House Minority Leader Hakeem Jeffries (D-NY) said in a joint statement on the current Homeland Security funding bill, which would allocate $500 million to developing “common sense” accountability measures for any extrajudicial killings carried out at the behest of the federal government. “It is vital that the Department of Homeland Security uphold the rule of law when indiscriminately gunning down innocent civilians in the street; otherwise, the whole system could fall apart. Rather than doing things by the book, these officers are out there slaughtering everyday Americans without first filing the proper paperwork with the appropriate agencies. Our framework is designed to ensure that ICE conducts itself like every other law enforcement agency in the nation, enacting violence upon our populace with impunity and without consequence.” Jeffries added that he empathized with immigrant communities who live in fear knowing that at any moment they could be killed without administrative due diligence."
https://theonion.com/tim-allen-calls-out-oscars-for-failure-to-recognize-movies-where-guy-turns-into-dog/,Tim Allen Calls Out Oscars For Failure To Recognize Movies Where Guy Turns Into Dog,"","LOS ANGELES—Noting that this year’s nominations had once again completely omitted an important sector of cinema, actor Tim Allen took to social media Thursday to call out the Oscars for failing to recognize movies where a guy turns into a dog. “By not elevating these films, the Academy is sending the message that stories about a guy who turns into a big dopey dog to learn an important lesson about family don’t matter as much as other stories,” Allen wrote in an Instagram post, observing that this year’s Academy Awards would mark the 98th consecutive ceremony in which no films about a guy who turned into a dog would be recognized. “Not only is this unjust, but it’s also discouraging for a generation of young filmmakers who want to make a movie in which a dad turns into a sheepdog in the middle of his son’s Little League game and starts wildly chasing after the ball. If we want to see the next The Shaggy D.A., we need to do better. All of us.” At press time, Allen had created a petition calling for more guys who turn into dogs sometimes to be added to the Academy’s voting body."
https://theonion.com/nation-yearns-for-relative-calm-of-president-a-giant-pedophile-news-cycle/,Nation Yearns For Relative Calm Of ‘President A Giant Pedophile’ News Cycle,"","WASHINGTON—Expressing deep fondness for those long-gone halcyon days, the U.S. population collectively yearned Tuesday for the relative calm of the “president is a giant pedophile” news cycle. “It was a simpler time then, back when all people wanted to talk about was the leader of the country molesting underage girls,” said Denver resident Scott Munoz, one of millions of Americans who noted the comparative peacefulness of the public discourse that surrounded Donald Trump possibly using his friendship with the late sex trafficker Jeffrey Epstein to prey on helpless minors and contrasted it with the current tumult marked by the president undermining global alliances in pursuit of Greenland, unlawfully capturing Venezuelan President Nicolás Maduro, and encouraging the violence of ICE agents. “I’m not saying everything was perfect when all the country cared about was the commander-in-chief groping prepubescent girls, but nowadays it’s almost quaint to think that we were once so concerned that the president had signed an incriminating letter about secretly being attracted to children, and that his signature was intended to double as the pubes on a lewd drawing. Lately, when I hear about ICE murdering people in the streets, I know I shouldn’t have taken that time for granted.” Munoz added that if he had to choose an island, he would choose Pedophile over Greenland any day."
https://theonion.com/victoria-beckham-asks-reddit-to-explain-beckham-family-feud-to-her/,Victoria Beckham Asks Reddit To Explain Beckham Family Feud To Her,"","LONDON—Determined to get to the bottom of the highly publicized estrangement, fashion designer Victoria Beckham reportedly took to Reddit Tuesday to anonymously ask for someone to explain the Beckham family feud to her. “Sorry, I’m feeling kind of out of the loop here, could someone explain what’s going on with the son?” the 51-year-old Beckham wrote in a thread on the r/popculturechat forum, refreshing the page as she waited for another user to help fill her in on the details. “If you ask me, it kind of just seems like the son Brooklyn is acting like a spoiled brat, but am I wrong? Is there part of the drama I missed? And what’s up with his wife? Nichola? Nikola? Is she famous or something, because I really don’t get her deal at all.” At press time, sources confirmed Beckham was no closer to understanding the family feud."
https://theonion.com/alex-honnold-successfully-free-solos-taipei-101-skyscraper/,Alex Honnold Successfully Free Solos Taipei 101 Skyscraper,"","Climber Alex Honnold successfully scaled the Taipei 101 skyscraper, the 11th tallest in the world, without a harness, ropes, or any other safety equipment. What do you think?
“We’ve finally put a man on the roof.”
“Anyone could do that if they were the best climber in the world.”
“This guy would love REI. They’ve got a climbing wall inside the store!”"
https://theonion.com/trump-claims-u-s-used-discombobulator-weapon-in-maduro-raid/,Trump Claims U.S. Used ‘Discombobulator’ Weapon In Maduro Raid,"","President Donald Trump said the U.S. used a weapon he referred to as “the discombobulator” to capture former Venezuelan President Nicolás Maduro, claiming it made the enemy equipment “not work.” What do you think?
“Every nation has a sovereign right for their head of state to remain combobulated.”
“Our military contracts with Dr. Ballyhoo’s Fantabulous Gizmo Emporium are paying off big time.”
“Cut the technical jargon, college boy.”"
https://theonion.com/trumps-first-year-in-office/,Trump’s First Year In Office,Trump’s First Year In Office,"Since returning to the White House, President Trump has significantly escalated his incendiary rhetoric, legally dubious policy decisions, and challenges to democratic norms. The Onion  looks back at the first year of his second term in office."
https://theonion.com/trump-alleges-that-democrats-secretly-paid-alex-pretti-to-be-model-citizen/,Trump Alleges That Democrats Secretly Paid Alex Pretti To Be Model Citizen,"","WASHINGTON—Claiming that no one would realistically devote their life to serving others without being funded by nefarious actors, President Donald Trump alleged Monday that Democrats had secretly paid Alex Pretti, the 37-year-old Veterans Affairs nurse killed by U.S. Border Patrol agents in Minneapolis, to be a model citizen. “What they don’t want you to know is that George Soros and his far-left billionaire friends hired Alex Pretti to act as a dependable, beloved pillar of his community for decades,” said Trump, adding that there was no way a man could be so universally beloved by every member of his family, community, and workplace unless some kind of “Democratic dark money” was at play. “Nowadays, people like Alex Pretti get a lot of money to live virtuous lives, follow the rules, and stand up for what’s right. This guy was paid a pretty penny to help war veterans, own a legal firearm but have no criminal record, and use his last words to ask a woman who had been thrown to the ground by federal agents if she was okay. And believe me, he laughed all the way to the bank. If the radical left have their way, we’ll have kindness like this taking over the country.” Trump added that federal immigration officers had no choice but to fatally shoot Pretti when they discovered millions of dollars in cash from Democrats on his body."
https://theonion.com/ilhan-omar-sprayed-with-liquid-at-town-hall/,Ilhan Omar Sprayed With Liquid At Town Hall,"","Rep. Ilhan Omar (D-MN) was rushed by a man during a town hall and sprayed with what was revealed to be apple cider vinegar from a syringe, the attack coming amid a broad surge in violence against lawmakers. What do you think?
“I hope this doesn’t make her afraid of all men running towards her with syringes.”
“You can’t arrest someone just because you disagree with their criminal actions.”
“Was there anything engraved on the liquid?”"
https://theonion.com/mark-platz/,Mark Platz,"","Mark Platz, 51, passed unexpectedly Sunday. He is survived by his wife, his three children, and a massive secret collection of troubling pornography."
https://theonion.com/tiktok-blocks-mentions-of-jeffrey-epstein/,TikTok Blocks Mentions Of Jeffrey Epstein,"","TikTok users in the U.S. claimed they were unable to write the word “Epstein” in messages, fueling accusations that the social media platform is suppressing content. What do you think?
“Man, I picked the wrong name for my cat.”
“Good. Kids should have to go outside to talk about Epstein.”
“Even compliments?”"
https://theonion.com/melania-trump-documentary-fails-to-sell-tickets/,Melania Trump Documentary Fails To Sell Tickets,"","Poor ticket sales for Melania Trump’s documentary Melania have led to rescue efforts by the GOP that include buying out theater seats to mask the film’s box office struggles, though many are reportedly still uninterested in attending screenings even when tickets are offered for free. What do you think?
“No thanks, I’ve already got tickets to Doug Emhoff in 3D.”
“I’m sure those numbers will tick up after a box office recount.”
“Who’s in it?”"
https://theonion.com/groundhog-harassed-by-dipshits-in-stupid-hats/,Groundhog Harassed By Dipshits In Stupid Hats,"",This field is for validation purposes and should be left unchanged.
https://theonion.com/new-manning-begins-budding-from-archies-back/,New Manning Begins Budding From Archie’s Back,"",This field is for validation purposes and should be left unchanged.
https://theonion.com/the-beginning-of-the-end/,The Beginning Of The End,"","Priced at $1.5 million, this two-bedroom bungalow will send a clear message to every working-class family still in the neighborhood that their days are truly numbered.
Reference #7086"
