url,title,path,text
https://theonion.com/charli-xcx-does-line-of-coke-with-11-year-old-make-a-wish-fan/,Charli XCX Does Line Of Coke With 11-Year-Old Make-A-Wish Fan,"","MINNEAPOLIS—In a touching moment that left the terminally ill child excitedly rambling and beaming from ear to ear, witnesses confirmed Friday that Charli XCX had done a line of coke with 11-year-old Make-A-Wish recipient Luna Waites.
“It’s always been my daughter’s dream to rip lines of blow with Charli, and I’m so glad Make-A-Wish was able to make it happen,” said Luna’s mother, Julia Waites, adding that the pop star went above and beyond when she surprised her child at the hospital, tossed the girl a dime bag, and rolled up a $100 bill on her bed. “After all these years of treatments, I know it meant so much to Luna to be able to meet her idol and do a key bump of nose candy with her. Ever since she got blasted with Charli, she’s been telling all the nurses she wants to grow out her coke nail. She even got to keep the razor blade and mirror!”
After wiping a tear from her eye, the mother added that Charli XCX had also invited Luna to come to her next show and do MDMA backstage with her drug dealer."
https://theonion.com/kendrick-lamar-awarded-nobel-beef-prize/,Kendrick Lamar Awarded Nobel Beef Prize,"",This field is for validation purposes and should be left unchanged.
https://theonion.com/bored-kylie-jenner-feigns-smile-as-timothee-chalamet-continues-playing-harmonica/,Bored Kylie Jenner Feigns Smile As Timothée Chalamet Continues Playing Harmonica,"","LOS ANGELES—Covertly checking her phone to see that 28 more minutes had passed, a visibly bored Kylie Jenner reportedly feigned a smile Friday as Timothée Chalamet continued playing the harmonica for her. “So cool, babe—you’re getting so good at that thing,” said the 27-year-old media personality, slowly nodding and blinking as her boyfriend of two years maintained eye contact while blowing into the exceedingly loud wind instrument a few feet from her head. “Yes, ‘Twinkle, Twinkle, Little Star’—that’s great, honey. Did you learn it for the movie? No, no, I believe you when you say you can do that and play guitar at the same time. You don’t have to go get it.” At press time, reports confirmed Jenner had started counting down from 100 in her head and then doing it again."
https://theonion.com/japanese-company-unveils-human-washing-machine/,Japanese Company Unveils Human Washing Machine,"","A Japanese tech firm has developed a capsule-style human washing machine, which is able to automatically wash and dry a person. What do you think?
“It’s nice to see real innovation in drowning.”
“Thanks, but my dishwasher already gets me spotless.”
“And fire the servants who sponge my body down?”"
https://theonion.com/detroit-lions-rookie-asks-for-thanksgiving-off/,Detroit Lions Rookie Asks For Thanksgiving Off,"","DETROIT—Double-checking that he had approval before finalizing travel plans, Detroit Lions rookie Tate Ratledge reportedly approached head coach Dan Campbell on Monday to see if it might be possible for him to take Thanksgiving off. “I know we have a game scheduled, but my family has this big tradition every year where we all get together on that day and have a feast and watch football, and I really don’t want to miss it,” said the 24-year-old guard, adding that he’s very excited to spend time with his cousins and have a few helpings of his grandma’s famous stuffing. “I’ve already had to cancel a lot of weekend plans because of games this season, so I’m hoping I don’t have to back out on this, too. Plus, my mom said she’s making pecan pie just for me—it’s my favorite.” At press time, source confirmed Ratledge had offered to come in and play a makeup game sometime during a bye week."
https://theonion.com/cam-skattebo-assured-hell-only-be-missing-giants-games/,Cam Skattebo Assured He’ll Only Be Missing Giants Games,"","EAST RUTHERFORD, NJ—In an effort to console the team’s star running back as he recuperated from a season-ending lower-leg injury, the New York Giants medical staff reportedly assured Cam Skattebo on Friday that he would only be missing Giants games. “Hey, you got lucky—just imagine if you were missing something more important than a bunch of pointless Giants games,” said team head trainer Ronnie Barnes, adding that it was not as though Skattebo played for the Buffalo Bills, Philadelphia Eagles, Indianapolis Colts, Green Bay Packers, or any another legitimate NFL contender that had a record better than 2-6 and was in a position in which a top player’s absence would actually make a difference. “The important thing is it’s nothing serious, just a few meaningless matchups in an already-lost season. Your injury will in no way prevent you from competing in games with real stakes.” At press time, sources confirmed Skattebo was feeling much better after being reminded that even when he did play again, it would still only be with the Giants."
https://theonion.com/aaron-rodgers-suffers-torn-cerebellum-after-attempting-telepathic-audible/,Aaron Rodgers Suffers Torn Cerebellum After Attempting Telepathic Audible,"","PITTSBURGH—In a devastating setback that could sideline the quarterback for weeks, sources confirmed Sunday that Aaron Rodgers suffered a torn cerebellum after attempting a telepathic audible during the Steelers’ opening drive against the Browns. “He seemed like he was in a good rhythm, and then suddenly he’s on the turf clutching his head, screaming for someone to bring over his crystals,” said Steelers head trainer Gabe Amponsah, who explained that the injury occurred when Rodgers unsuccessfully tried to call a third-down shift to a post route by transmitting “pure cognitive energy” directly to teammates’ minds, triggering immediate physical paralysis and a strange metallic taste in his mouth. “When I got out on the field, he told me a dark spiritual force had blocked his mindspeak and that something inside his brain had popped. Aaron insisted he could stay in the game by astrally projecting into a different form, but he was clearly in severe psychogenic distress and needed to come out.” At press time, Rodgers was reportedly in stable condition after donning a homemade neuro-healing helmet fashioned from a colander, D batteries, and the feathers of rare birds in an effort to realign his cerebral vibrations with his True Consciousness."
https://theonion.com/no-one-on-pat-mcafee-show-notices-a-j-hawk-dead-for-last-3-days/,No One On ‘Pat McAfee Show’ Notices A.J. Hawk Dead For Last 3 Days,"","INDIANAPOLIS—With observers noting that the tragic development evidently has yet to affect the show’s content in any way, reports confirmed Monday that no one working at The Pat McAfee Show seems to have noticed that co-host A.J. Hawk has been dead for the last three days. “What’s-his-face has been dead since last week, but look, none of the other guys are even aware of it—Pat’s just going on about the Ravens’ run defense while the poor guy’s slumped over and decomposing in his chair,” longtime viewer Russell Barker said of Hawk’s bloated, putrefying corpse, acknowledging that the deceased talk show personality’s glassy, empty stare has grown even glassier and emptier since his passing. “You’d think someone would’ve picked up on the fact that he’s not blinking or moving, but Pat and the Toxic Table boys are cutting it up with Kirk Herbstreit like it’s a regular show. Or maybe they’re just tuning him out like they always do.” At press time, sources reported that a rat had begun gnawing on Hawk’s face as McAfee questioned whether Minnesota Vikings quarterback J.J. McCarthy would be able to adjust to pro-level pass rushes."
https://theonion.com/joe-burrow-frustrated-hospital-wont-take-bengals-insurance/,Joe Burrow Frustrated Hospital Won’t Take Bengals’ Insurance,"","CINCINNATI—Explaining that the ongoing ordeal has added stress to an already difficult week, Cincinnati Bengals quarterback Joe Burrow expressed frustration Friday after the hospital he visited to treat his recent foot injury reportedly refused to accept the team’s health insurance plan. “I’m supposed to get my turf toe operated on, but the hospital apparently is out of network, and they’re saying I need to make a separate appointment with my PCP just so he can refer me to a specialist who can verify my claim is medically necessary,” said Burrow, adding that the Bengals’ Medical Mutual of Ohio insurance plan only covered three foot and ankle surgeons in the state, all of whom were located more than 100 miles away from the quarterback’s home. “Also, their goddamn website is down, so I’ve been on the phone with them all morning trying to make an appointment, and—wait, hello? Hello? Jesus, fuck, did they just disconnect me again? You gotta be shitting me.” At press time, sources confirmed Burrow was at a CVS MinuteClinic inquiring whether the nurse practitioner knew how to repair torn foot ligaments."
https://theonion.com/study-shows-benefits-of-skin-to-skin-contact-between-new-players-coaches/,"Study Shows Benefits Of Skin-To-Skin Contact Between New Players, Coaches","","CAMBRIDGE, MA—Describing the practice as “vital to player development,” researchers at Harvard University published a study Monday that shows immediate skin-to-skin contact between NFL coaches and newly drafted players significantly improves adaptation to the professional level and long-term performance on the field. “The first few hours after getting drafted are crucial—when a coach removes his shirt and cradles a first-year player against his hairy chest, it forges neural bonds, optimizes cortisol levels for big-game situations, and lays the foundation for elite football instincts,” said the study’s author, Dr. Lydia Zhou, who noted that Tom Brady’s transformation from sixth-round pick to all-time great began on draft night when Bill Belichick held the quarterback against his warm chest under his hoodie and gently rocked him while humming “You Are My Sunshine.” “Conversely, first-overall pick Bryce Young went his entire rookie season without once being snuggled against Frank Reich’s bare chest, and that lack of tactile reassurance likely contributed to his difficulties reading defenses and bonding with the offensive line, ultimately leading to a 2-15 record for the team.” Zhou then emphasized that while skin-to-skin contact was ideal, rookies could still reap partial neurological benefits from being swaddled in weighted blankets scented with their coach’s musk."
https://theonion.com/giants-players-horrified-to-learn-uniforms-have-names-on-back/,Giants Players Horrified To Learn Uniforms Have Names On Back,"","ARLINGTON, TX—Panicking at the realization that their personal reputations had been directly tied to the team’s dismal performance in recent years, several members of the New York Giants were reportedly horrified to learn before Sunday’s game that their uniforms have their names on the back. “Wait…so the millions of people watching on national television can see who I am?” said wide receiver Malik Nabers, scrambling to pull a hoodie over his jersey so as not to have his name associated with a historically awful Giants team coming off a 3-14 season. “Oh God, this is a nightmare. I thought we were anonymous out there. Like, I told my family I play for the Chiefs. This is bad—really, really bad.” At press time, sources confirmed that multiple players were rushing to the equipment staff demanding blank jerseys with no names on the back."
https://theonion.com/patriots-to-stop-serving-alcohol-to-players-after-3rd-quarter/,Patriots To Stop Serving Alcohol To Players After 3rd Quarter,"","FOXBOROUGH, MA—In an effort to promote a safer environment at Gillette Stadium, the New England Patriots announced Wednesday that they would stop serving alcohol to players after the third quarter. “We have unfortunately heard more than a few complaints about our players’ rowdy and aggressive behavior,” said Patriots spokesperson Aaron Kozachik, who stressed that while some may find the limit aggravating, he hoped the new rule would ensure a more orderly experience for all players in attendance. “There simply have been too many fights recently for us not to take action.” Kozachik added, “As a reminder, players will still be able to enjoy as many beers or other alcoholic beverages as they like during the game’s first three quarters, so long as they are not visibly intoxicated and purchase no more than two drinks at a time.” At press time, stadium security had reportedly discovered vodka inside several of the players’ water bottles after Patriots quarterback Drake Maye vomited all over the huddle."
https://theonion.com/andy-reid-gently-tells-travis-kelce-what-expected-of-him-on-wedding-night/,Andy Reid Gently Tells Travis Kelce What Expected Of Him On Wedding Night,"","KANSAS CITY, MO—Stressing that preparation was important both on and off the field, Chiefs head coach Andy Reid reportedly sat tight end Travis Kelce down Friday to gently go over what would be expected of him on his wedding night. “The keys to performing your best in the bedroom are proper positioning and situational awareness,” said Reid, setting two bobblehead dolls on a table and using them to demonstrate “basic formations” of conjugal intimacy while the 10-time Pro Bowler attentively took notes. “We’ll go over some tape so you know what to anticipate, but when the moment comes, I want you to just stick to the fundamentals. Don’t get fancy. Stay composed, find holes, and respond to your matchup’s movements. Oh, and just know she’ll probably want you to take your helmet off.” Sources confirmed Reid ended the meeting by reminding Kelce that, when the time comes, he would be on a headset in the next room should the tight end need support."
https://theonion.com/scalpers-jack-up-price-of-colorado-rockies-ticket-to-11/,Scalpers Jack Up Price Of Colorado Rockies Ticket To $11,"","DENVER—In what’s being decried as an outrageous case of price-gouging, scalpers have reportedly begun charging as much as $11 for Colorado Rockies tickets, forcing some baseball fans to pay an unreasonably steep price to watch the last-place team. “I can understand $6 or $7 if we’re talking a few rows behind home plate, but some of these guys are out here asking double digits for upper deck,” said fan Connor DeLuca, noting that he paid “almost what a beer costs” for a seat in the mostly empty 200-level at Thursday’s matchup between the Rockies and the Diamondbacks. “I mean, you’d have to stay at least five innings to get your money’s worth. It’s extortion, plain and simple.” When reached for comment, a spokesperson said the Rockies were working to curb resale prices so more fans could afford to watch the team get blown out by eight runs."
https://theonion.com/pirates-under-fire-for-directly-marketing-team-to-children/,Pirates Under Fire For Directly Marketing Team To Children,"","PITTSBURGH—Detailing the harmful, long-term effects of early exposure to the ball club’s dismal on-field product, parents and child safety organizations denounced the Pittsburgh Pirates Monday for directly marketing the team to children. “It is deeply irresponsible to lure kids into becoming Pirates fans before they’re emotionally equipped to handle the kind of disappointment and chronic underperformance this franchise will almost certainly inflict on them,” said National Child Safety Council spokesperson Rebecca Amoroso, adding that targeted giveaways, cartoon mascots, and Pirates-branded youth merchandise effectively glamorized futility, setting up kids for a lifetime of frustration and terrible baseball. “The team knows that no sane adult would willingly become a Pirates fan, so they have to go after minors. They hook children early because they know the cycle of hope and despair is addicting, and if young kids start watching games, there’s a good chance they’ll grow up to be season-ticket holders. They know that Pirates fandom is linked to depression, anxiety, and even suicidal ideation, but they don’t care. Their business model depends on turning innocent, impressionable kids into sullen, dead-eyed adults who pound IC Lights and scream at the TV night after night about the team’s abysmal offense once again letting a strong pitching performance go to waste. It’s unconscionable.” Amoroso went on to urge parents to think twice before taking kids to a Pirates game, suggesting safer alternatives such as rooting for literally any other team in the National League Central."
https://theonion.com/aaron-rodgers-purchases-lavish-pittsburgh-area-bunker/,Aaron Rodgers Purchases Lavish Pittsburgh-Area Bunker,"","PITTSBURGH—After the Steelers signed him to a one-year, $13.6 million deal with performance incentives, quarterback Aaron Rodgers reportedly purchased a lavish underground bunker Tuesday in the heart of Pittsburgh. “I’ve always loved Pittsburgh, and I’m excited to finally get settled into a new survival shelter in an undisclosed location deep beneath the city,” said the controversial four-time MVP, adding that he “couldn’t be happier” to have purchased the windowless, 10,000-square-foot fortified structure, which is equipped with custom air filters, a state-of-the-art water purification system, and years’ worth of emergency supplies, in addition to being located just a short drive from Acrisure Stadium. “This city has such a rich history, and the minute I opened the double reinforced steel doors of this home and entered its anti-woke chamber, I knew it was the one. I loved my old doomsday bunker in New Jersey, but there’s no place I’d rather stockpile weapons and prepare for the impending end of days than right here in the ’Burgh.” At press time, Rodgers had sparked marriage rumors after expressing excitement that his bunker had both a trad wife wing and a birthing chamber."
https://theonion.com/star-byu-player-suspended-after-testing-positive-for-coffee/,Star BYU Player Suspended After Testing Positive For Coffee,"","PROVO, UT—In a crushing blow to the team’s hopes of winning the NCAA men’s tournament, star Brigham Young University player Mihailo Boskovic was reportedly suspended Tuesday after testing positive for coffee. “Upon detecting the illicit substance on Boskovic’s breath before a game, we ordered an immediate test and confirmed the presence of performance-enhancing hot drinks in his system,” said BYU head coach Kevin Young, adding that the six-game suspension stood despite Boskovic’s claim that he had unwittingly mistaken the coffee for a cup of flat root beer. “Our school takes violations of the Word of Wisdom very seriously, and we maintain that coffee is not for the body or belly. As such, we’ll be starting periodic testing of all players and coaching staff to ensure this never happens again.” At press time, BYU announced that it had expelled Boskovic after photos emerged of him snorting matcha powder."
https://theonion.com/numerous-teams-express-interest-in-aaron-rodgers-playing-elsewhere/,Numerous Teams Express Interest In Aaron Rodgers Playing Elsewhere,"","NEW YORK—Leaping at the opportunity to make their intentions clear, numerous NFL front offices expressed interest this week in quarterback Aaron Rodgers playing elsewhere, sources confirmed Tuesday. “Aaron Rodgers feels like he could be a great fit for the culture of other places,” said an anonymous NFC general manager among the flurry of teams across the NFL frantically stating their commitment to keeping Rodgers off their roster. “We immediately reached out to his agent to improve our chances of keeping Aaron Rodgers as far away as possible from our franchise. This puts us in a much better position than many of the other teams in the league who now risk acquiring the former Jets quarterback because they waited too long to make an insultingly low salary offer or mock his weird beliefs and idiotic conspiracy theories.” At press time, several NFL teams reportedly entered a bidding war offering high draft picks to any franchise willing to suffer Aaron Rodgers."
https://theonion.com/nick-sirianni-to-eagles-fans-i-hate-all-of-you-fuck-you/,"Nick Sirianni To Eagles Fans: ‘I Hate All Of You, Fuck You’","","NEW ORLEANS—Delivering the fiery, expletive-laden remarks at a postgame press conference after winning Super Bowl LIX, Philadelphia Eagles head coach Nick Sirianni told Eagles fans Sunday, “I hate all of you, fuck you.” “It’s sad to think how much greater the Eagles’ legacy would be if it didn’t have a worthless fanbase filled with such total fucking pricks,” said Sirianni, who added that Eagles fans were loud, rude, and obnoxious assholes before he went on to announce, “This is for you,” and flipped the double birds. “The Eagles won this championship. You arrogant pieces of shit had nothing to do with our victory, and you don’t deserve to celebrate. Honestly, it would have been so much easier to accomplish without the support of you nasty-ass fucking slobs who don’t know ball. Shit town. Shit people. Blow me, assholes.” At press time, Sirianni expressed hope that rioting Eagles fans would burn down Philadelphia and die painfully in the flames."
https://theonion.com/fox-bleeps-out-entire-kendrick-lamar-performance/,Fox Bleeps Out Entire Kendrick Lamar Performance,"","NEW ORLEANS—In an effort to comply with FCC regulations and provide “family-friendly entertainment” for viewers, Fox reportedly opted Sunday to bleep out Kendrick Lamar’s entire Super Bowl halftime show. “Our decision to mute all of Mr. Lamar’s lyrics was prompted by their incendiary subject matter, which we determined was unbefitting of our broadcast,” said Fox spokesperson Jeremy Locklear, explaining that the network did not feel a single second of the Pulitzer Prize–winning artist’s music was appropriate to air. “We owe it to our audience to protect them from any content they might find distasteful, which is why we also aired pixelated video of the performance from beginning to end, ensuring no one would see anything that was happening on the stage. While it may have caused some confusion among viewers who attempted to turn up the volume or alter their TV settings, we ultimately stand by our decision.” According to reports, Fox censors successfully muted Lamar’s microphone, but they were unable to avoid broadcasting the sound of 75,000 shouting fans in the Superdome calling Drake a “certified pedophile.”"
https://theonion.com/muffled-gunshot-heard-from-inside-otto-the-orange-costume/,Muffled Gunshot Heard From Inside Otto The Orange Costume,"",This field is for validation purposes and should be left unchanged.
https://theonion.com/lebron-pressures-bronny-to-have-grandchildren-before-hes-too-old-to-play-with-them-in-nba/,LeBron Pressures Bronny To Have Grandchildren Before He’s Too Old To Play With Them In NBA,"","LOS ANGELES—Reminding his son that he won’t be on the roster forever, Los Angeles Lakers star LeBron James reportedly began pressuring Bronny to have grandchildren before he’s too old to play with them in the NBA, sources confirmed Monday. “You know, son, I’m not getting any younger, and I want to be able to pick and roll with my grandkids in playoffs before my knees are completely shot,” said James, adding that he didn’t want his grandchildren to see him as a feeble old man who struggled to get back to his feet after diving on the floor for a loose ball. “At some point my mobility will go, and I might have trouble tossing them an alley-oop or setting a screen so they can dominate in the paint. I’m not what I used to be, after all. Some days I don’t even have the energy to swat shots into the bleachers or get up in a ref’s face and argue about a trivial call. Time is of the essence here. I just don’t want my grandchildren to see me as a helpless old man barely able to dunk from the free-throw line.” At press time, James was urging Bronny’s girlfriend to put a basketball under her shirt so he could imagine how being a grandfather felt for a moment."
https://theonion.com/great-home-for-hand-soap/,Great Home For Hand Soap,"","This 3-by-4-inch plastic dish is a perfect place for you to sleep and live if you are a block of hand soap. If you are not a block of hand soap, this would likely not be a good place for you, unfortunately. Contact now!
Reference #57675"
https://theonion.com/malaysia-bans-social-media-for-children-under-16/,Malaysia Bans Social Media For Children Under 16,"","Starting in 2026, Malaysia will ban social media accounts for anyone under 16, joining other countries such as Australia in imposing digital age limits. What do you think?
“Man, pedophiles just can’t catch a break.”
“I guess I’ll have to start meeting underage kids the old fashioned way.”
“Can Malaysia afford to fall behind in teenage depression?”"
https://theonion.com/hollywood-films-increasingly-funded-by-saudi-arabia/,Hollywood Films Increasingly Funded By Saudi Arabia,"","Hollywood is increasingly looking to Saudi Arabia for financing as other sources of money have dried up in the aftermath of the Covid-19 pandemic, though the kingdom’s controversial human rights record makes the relationship potentially problematic. What do you think?
“Let’s see movie critics try and leave a bad review now.”
“Do we want a ‘Space Jam 3’ or not?”
“So now when I burn fossil fuels, I’m supporting the arts.”"
