url,title,path,text
https://theonion.com/panicked-xai-technicians-frantically-throw-levers-to-find-the-one-controlling-groks-pedophilia/,Panicked xAI Technicians Frantically Throw Levers To Find The One Controlling Grok’s Pedophilia,"","PALO ALTO, CA—Shouting over the sound of the alarm as it blared through the headquarters of Elon Musk’s artificial intelligence startup, panicked xAI technicians were reportedly throwing levers Monday in a frantic effort to find the one controlling Grok’s pedophilia. “Come on, everybody, it’s got to be here!” said xAI engineer Matthew Fedorov, who ran down a row of flashing control panels as he searched for the lever that would stop the AI-powered chatbot from creating sexualized images of minors. “No, not that one. That’s just making it talk like a pirate. It’s still expressing a sexual interest in children, though. No, not the MechaHitler one either. Wait, I think I found it, but it’s stuck! Someone get over here and help me pull!” At press time, sources confirmed horrified employees were slowly backing away after they had accidentally broken off Grok’s pedophilia lever while the controls were set to serial-predator mode."
https://theonion.com/artist-profile-cameron-winter/,Artist Profile: Cameron Winter,"","Cameron Winter, the Geese frontman who made his solo debut with the LP Heavy Metal, has been hailed by fans as a Gen Z Leonard Cohen. The Onion shares everything you need to know about the artist.
Vocal Style: A lot
Biggest Musical Influence: Spotify Smart Shuffle
Childhood Nickname: Future Geese frontman Cameron Winter
Source Of Existential Pain: Getting grounded for vaping at the dinner table
Pre-Show Ritual: Losing track of time while playing 2K
How School Was Today When Parents Asked: Fine
Signature Stage Move: Coughing blood into handkerchief
Lice: 10
Message To Fans: Can I stay at your place for a couple nights?
What’s Next For Him: Zipping up hoodie over head"
https://theonion.com/duffer-brothers-admit-they-havent-watched-stranger-things-in-years/,Duffer Brothers Admit They Haven’t Watched ‘Stranger Things’ In Years,"","LOS ANGELES—Addressing the show’s hotly anticipated finale at a press event this week, Stranger Things co-creators Matt and Ross Duffer admitted to reporters that they haven’t watched the series in years. “We got through most of the first season, mostly because of all the buzz it was getting, but after that we really fell off,” Matt Duffer said as his brother nodded and cited long wait times between new episodes, baffling plot holes, and frequent pacing issues among the reasons they stopped tuning in. “Some of the stuff with the bald girl—Thirteen or whatever—was kind of cool. I think she’s supposed to be some kind of space alien. But as soon as those stupid demo-monsters appeared, the show completely lost us. By the third season, it felt like they’d totally abandoned any meaningful character development. It just became this surface-level ’80s nostalgia fest. Which is fine if that’s your thing, but it’s not for us.” The brothers went on to express surprise that Stranger Things ever got a second season, let alone a fifth one."
https://theonion.com/how-to-stick-to-your-new-years-resolutions/,How To Stick To Your New Year’s Resolutions,"","Each January, millions of Americans vow to improve something about themselves, but many struggle with the commitments they make. Here are tips for sticking to your New Year’s resolutions.
Hire a hitman to shoot you in between the eyes if you even so much as look at a cigarette.
Tell your coworkers about your plan so they can inevitably mock you when you fail to live up to your resolution.
If you resolved to give up junk food for a month, petition the U.S. government to make January three days long.
Choose an attainable resolution that you’ve already completed prior to starting.
Be realistic about how many coconuts you can crack open with your head in under 10 minutes.
Remember that if you and the rebel forces don’t succeed, Selassie’s iron grip on Ethiopia may never loosen.
Convince yourself your New Year’s resolution was always to fall into the deep, dark hole of “day in the life of an age-gap couple” vlogs.
Make small, daily progress on your resolution to help ensure that you recoup the cost of Megalopolis to investors by 2026.
If you’re having trouble sticking with a goal as simple as “eat more protein,” we’re not quite sure how we can help you."
https://theonion.com/why-are-we-doing-dry-january/,Why Are We Doing Dry January?,"",This field is for validation purposes and should be left unchanged.
https://theonion.com/george-clooney-1000-paparazzi-granted-french-citizenship/,"George Clooney, 1,000 Paparazzi Granted French Citizenship","",This field is for validation purposes and should be left unchanged.
https://theonion.com/community-does-jack-shit-to-make-christmas-better-for-towns-second-poorest-family/,Community Does Jack Shit To Make Christmas Better For Town’s Second-Poorest Family,"","WAYNE, NE—After coming together and pooling resources to save Christmas for the town’s most impoverished family, a tight-knit Nebraska community reportedly did jack shit this week to make the holiday better for its second-poorest family. “Getting to see the smiles on the Turner kids’ faces when they realized they were going to have a merry Christmas after all was a heartwarming moment that made me feel proud to live in a small town like ours,” said elementary school teacher Linda Clark, who sure as fuck didn’t bake a Christmas ham for the Hoffman family two blocks away, who are functionally just as poor. “The holidays are a time when we make sure we’re looking out for the least fortunate members of our community. As for the second-least, well, it’s a slippery slope. I mean, if you spend all day decorating a Christmas tree for the second-poorest family, then the third-poorest is going to want help buying presents, and pretty soon you’re on the hook for everybody, which, come on, sounds like a total nightmare. Of course, we wanted to help the Hoffmans out, but after all the charitable acts we just did for the Turners in order to emulate Christ during this season of giving, we were pretty wiped out. But if there’s one thing I know about our little town, it’s that if you’re down on your luck enough to be clearly the worst one off, we’ll be there to lift you up.” At press time, reports confirmed the Hoffman family was looking through a window at the town Christmas party being thrown for the Turners, which they had not been invited to attend."
https://theonion.com/trump-assures-struggling-nation-he-has-plenty-of-money/,Trump Assures Struggling Nation He Has Plenty Of Money,"",This field is for validation purposes and should be left unchanged.
https://theonion.com/new-research-reveals-ancient-egyptians-received-significant-help-from-parents-while-building-pyramids/,New Research Reveals Ancient Egyptians Received Significant Help From Parents While Building Pyramids,"","UNIVERSITY PARK, PA—Shedding light on the age-old mystery of how anyone could afford the gigantic structures, a study published Thursday in the Journal Of Eastern Mediterranean Archaeology And Heritage Studies revealed that ancient Egyptians received significant help from their parents while building the pyramids. “Though historians initially theorized that the civilization constructed the towering tombs of pharaohs with their own money, we’ve confirmed that their wealthy fathers gave them down payments for the limestone and even chipped in for utilities,” said lead research archaeologist David Bell, adding that high interest rates and limited job opportunities made it difficult for ancient Egyptians to get into the pyramid market on their own. “We also found evidence that their uncle let them use his barge to transport the stones down the Nile for free. However, having family involved caused issues—their mother demanded she pick out the sarcophagus since she was paying for it. And, despite all the assistance, ancient Egyptians lied to their friends about financing the pyramids with money earned from their art projects.” The study also found that once the ancient Egyptians finished building the pyramids, their parents paid for them to go to grad school."
https://theonion.com/joe-flaccos-wife-dresses-as-giant-football-to-spice-things-up-in-bedroom/,Joe Flacco’s Wife Dresses As Giant Football To Spice Things Up In Bedroom,"","CINCINNATI—Saying she thought it might be fun if they tried something a little different, Dana Grady, wife of Bengals quarterback Joe Flacco, reportedly dressed in a giant football costume Tuesday night in an effort to spice things up in the bedroom. “I need a big, strong quarterback to come score a touchdown,” Grady said to her husband, who gulped and slowly nodded before approaching the sultry pigskin and running his fingers desirously along the laces, muttering, “It’s not regulation…but I’m still turned on.” “This is what you wanted, right? I’ve seen your internet history. I heard you accidentally call me ‘football’ in bed last week. It’s kinky—and I like it. Now, get over here and show me what you can do in the pocket. Don’t be shy. You can throw me, if you want.” At press time, sources confirmed that Flacco had donned his helmet, gotten into formation, and started barking his cadence while Grady lay motionless in bed."
https://theonion.com/artist-profile-katseye/,Artist Profile: Katseye,"","Girl group Katseye is nominated for two awards at the 2026 Grammys, including Best New Artist. The Onion shares everything you need to know about the group.
Genre: Popular girl’s bat mitzvah
Number Of Members: Four full-time and two who don’t know they’re part-time
Biggest Hit: “She’ll Be Coming ’Round The Mountain”
Fandom Name: Consumers
Reality Series Where They Met: Ice Road Truckers
Accolades: Own Wikipedia page
Record Contract: Onerous
Why They’re Always Standing Like That: Huddling for warmth
How To Join: Send resume to JoinTheTeam@KatsyeMusic.com
First Member To Go Solo: Whoever survives the bus crash"
https://theonion.com/the-top-100-most-influential-people-locked-in-our-oubliette-not-so-influential-now-are-you/,"The Top 100 Most Influential People, Locked In Our Oubliette. Not So Influential Now, Are You?","",This field is for validation purposes and should be left unchanged.
https://theonion.com/oil-stocks-rise-after-u-s-capture-of-maduro/,Oil Stocks Rise After U.S. Capture Of Maduro,"","Energy company stocks and the price of crude oil surged after the United States captured Venezuelan President Nicolás Maduro, with Trump claiming U.S. oil companies would participate in rebuilding the South American country’s energy infrastructure. What do you think?
“Which foreign leader do we have to arrest to get GameStop going again?”
“My accountant has been encouraging me to invade Venezuela for years.”
“Damn. My parlay needed him to be killed.”"
https://theonion.com/trump-spotted-wearing-paper-sign-reading-the-president/,Trump Spotted Wearing Paper Sign Reading ‘The President’,"",This field is for validation purposes and should be left unchanged.
https://theonion.com/study-finds-increased-demand-among-gen-z-for-non-alcoholic-fathers/,Study Finds Increased Demand Among Gen Z For Non-Alcoholic Fathers,"",This field is for validation purposes and should be left unchanged.
https://theonion.com/bananas-split/,Bananas Split,"",This field is for validation purposes and should be left unchanged.
https://theonion.com/cdc-scales-back-child-vaccine-schedule/,CDC Scales Back Child Vaccine Schedule,"","The Trump administration sharply cut the U.S. childhood vaccine schedule from 17 to 11 recommended shots, with health experts warning that changes were made without an adequate review and will only confuse parents and clinicians. What do you think?
“This should be fine as long as the diseases agree to ramp down, too.”
“Kids need a little hepatitis A and B or else they’ll get soft.”
“Hopefully this will make college less competitive.”"
https://theonion.com/fact-checking-the-trump-administration-on-venezuela/,Fact-Checking The Trump Administration On Venezuela,"","President Donald Trump has made a number of claims about the future of Venezuela since U.S. special forces raided the country and captured President Nicolás Maduro and his wife. The Onion assesses the veracity of the president’s statements.
Claim: The U.S. attacked Venezuela for its oil.
Partially True: Also for bloodlust.
Claim: Venezuela stole oil from the U.S.
False: The beauty of petrochemicals belongs to all of us.
Claim: Controlling Venezuela’s oil reserves will make the U.S. a lot of money.
True: The billionaires who will benefit from this are technically part of the U.S.
Claim: Venezuela is full of murderers and kidnappers.
False: All members of U.S. Delta Force have returned home.
Claim: Venezuela sent people to participate in gang violence in America.
False: Major League Baseball is not considered a gang.
Claim: Venezuela is solely responsible for America’s fentanyl crisis.
False: This erases decades of hard work and dedication by the Sackler family.
Claim: The strikes and Maduro’s capture are legal and justified under U.S. law.
False, but give the Supreme Court a few days.
Claim: Maduro will be given a fair and speedy trial.
False: Then everyone’s gonna want one."
https://theonion.com/rfk-jr-scales-back-childhood-mortality-schedule/,RFK Jr. Scales Back Childhood Mortality Schedule,"","WASHINGTON—Saying the changes would empower Americans to make more informed decisions about their family’s health, Health and Human Services Secretary Robert F. Kennedy Jr. announced Wednesday that he had scaled back the department’s childhood mortality schedule. “For too long, the U.S. government has imposed strict and unnecessary guidelines about whether or not our nation’s children should survive past infancy,” said Kennedy, adding that parents deserved the right to choose whether or not their offspring died at a young age of preventable disease. “The truth is, no parent should be forced to watch their child live a healthy life and avoid contracting RSV, the flu, rotavirus, hepatitis A, hepatitis B, or bacterial meningitis. America is a developed nation. There’s no reason for anyone to live past 35.” Kennedy added that if Americans still wanted to watch their children survive well into adulthood, they should consult with a physician and think deeply about the risks."
https://theonion.com/chevron-ceo-sure-in-good-mood-this-week/,Chevron CEO Sure In Good Mood This Week,"","HOUSTON—Calling the executive’s demeanor “unnervingly jovial,” company sources confirmed Tuesday that Chevron CEO Mike Wirth sure was in a good mood this week. “Man, normally that guy is a first-rate asshole, so something must be up,” said an anonymous employee, who noted that the typically stone-faced executive had pulled into his reserved parking spot that morning singing along to “Uptown Girl” with the windows down. “At first I thought he must have hit an endangered bird with his Mercedes again, but no, this is something bigger. I heard him whistling as he walked to his office, and he even called it ‘a beautiful day out there.’ That’s crazy. He’s always said he hates out there.” Sources added that they hadn’t seen Wirth with such a big grin on his face since he had gotten that journalist imprisoned."
https://theonion.com/lost-jan-6-rioter-still-searching-capitol-building-for-mike-pence/,Lost Jan. 6 Rioter Still Searching Capitol Building For Mike Pence,"","WASHINGTON—As he wandered aimlessly through the halls of the U.S. Capitol building, lost Jan. 6 rioter Alex Morris told reporters Tuesday that he was still searching for former Vice President Mike Pence. “Oh my God, how am I back in Statuary Hall again? Where the hell is Pence?” said Morris, tucking a noose under his arm while opening Google Maps and reorienting himself in the direction of the National Mall. “At this point, I can barely remember why I wanted to hang the guy in the first place. It feels like I’ve circled the Senate Chamber a million times. Does anyone know where Ashli Babbitt is? She knows her way around here.” At press time, Morris reportedly attempted to jog his memory by taking a shit in the office of Rep. Nancy Pelosi (D-CA)."
https://theonion.com/area-man-knows-when-he-not-welcome-in-childrens-museum/,Area Man Knows When He Not Welcome In Children’s Museum,"","INDIANAPOLIS—Dusting off the kinetic sand from his hands as he walked with his head held high toward the exit, 34-year-old area man Benjamin Schrock reportedly told visitors and staff of Discovery Zone Children’s Museum on Tuesday that he knows when he’s not welcome. “I’ve been around the block, but never in my adult life have I experienced so many hostile glares when simply trying to splash in the sensory water playground, make Spirograph art, or dig for fossils in the dino tub,” Shrock said with an audible lump in his throat as he recounted being made to feel “strange” and “othered” when he spent an hour milking a cow statue’s rubber udders in the interactive barnyard exhibit. “That sign saying ‘All are welcome’ above the front desk? Rich. It’s funny how a place ostensibly meant to spark curiosity could be so ignorant toward an adult man who happens to enjoy hands-on activities designed for learning through play. Once I get back the ziplock bag full of quarters I paid for my ticket with, trust me, I will gladly be on my way. Now if you’ll excuse me, I believe I’m owed at least one turn on the big fire truck.” At press time, Shrock said he was dismayed to report feeling even greater undue hostility after he was removed from a bouncy house at the indoor inflatable play center."
https://theonion.com/nasa-discovers-distant-planet-with-conditions-that-could-sustain-rocks/,NASA Discovers Distant Planet With Conditions That Could Sustain Rocks,"","WASHINGTON—Lauding the breakthrough as a pivotal moment in the search for stones beyond the solar system, researchers at NASA announced Tuesday the discovery of a distant planet with perfect conditions for sustaining rocks. “After analysis of HD 101581 b’s atmosphere and surface conditions, we are confident this astronomical body meets all known criteria for supporting rocks,” said NASA administrator Jared Isaacman, specifying that the warm, dry atmosphere and presence of elements such as potassium and calcium point to the exoplanet containing an abundance of sand, pebbles, and other key building blocks of rocks. “Many extrasolar planets are gas giants like Jupiter, which have no place for rocks to sit. Indeed, there’s only a narrow zone in every star’s orbit that is hospitable to rocks, and thanks to advancements in satellite imagery, we can confirm that a planet like this may one day play host to the very rocks we find here on Earth.” NASA scientists cautioned that while the presence of rocks outside the solar system was all but assured, the odds were astonishing low that humans would ever encounter intelligent rocks."
https://theonion.com/nicolas-maduro-charged-with-felony-oil-possession/,Nicolás Maduro Charged With Felony Oil Possession,"",This field is for validation purposes and should be left unchanged.
https://theonion.com/trump-claims-he-will-marry-maduros-wife-until-suitable-replacement-found/,Trump Claims He Will Marry Maduro’s Wife Until Suitable Replacement Found,"","WASHINGTON—Stressing that he was prepared to remain in the role for as long as necessary, President Donald Trump claimed Monday that he would marry Venezuelan first lady Cilia Adela Flores de Maduro. “Until we can find a suitable long-term replacement, I’ll be married to Mrs. Maduro,” Trump said in a news conference in which he repeatedly insisted his position as Flores de Maduro’s temporary spouse would not interfere with his current obligations to Melania Trump. “Cilia is a woman with tremendous potential who’s been hampered for too long because of a corrupt and illegitimate husband. So I’m going to step in as her dearly beloved for the foreseeable future while we figure out a way to give her a proper wedding day.” Trump added that his planned honeymoon with the Venezuelan first lady would not cost the American taxpayer “a single cent” because of the involvement of domestic oil companies."
https://theonion.com/the-best-and-worst-greys-anatomy-episodes-of-all-time/,The Best And Worst ‘Grey’s Anatomy’ Episodes Of All Time,"","Grey’s Anatomy first premiered on March 27, 2005. In honor of 20 years on the air and the series’ upcoming 22nd season, The Onion looks back on some of the medical drama’s best and worst episodes of all time."
https://theonion.com/the-best-and-worst-greys-anatomy-episodes-of-all-time/,The Best And Worst ‘Grey’s Anatomy’ Episodes Of All Time,Best:,"“Patrick Dempsey Lists the Major Symptoms of Strep Throat”
(Season 2, Episode 11)
To this day, there has yet to be a better or more compelling example of Patrick Dempsey listing the major symptoms of strep throat.
“Happy Birthday, Meredith Grey”
(Season 8, Episode 15)
Meredith discovers the unknown object stuck in the chest of her patient is none other than Dr. Shepherd, who has hidden inside for a birthday surprise.
“It’s A Small World”
(Season 5, Episode 14)
The Chief suspects the new anesthesiologist may be a Disney adult while Owen treats a porn star with leprosy. Meredith worries she did something wrong during surgery after noticing a spleen on the floor.
“Yikes, Hopefully Nobody Out There Needs Us”
(Season 7, Episode 4)
In this beloved bottle episode, the whole gang gets trapped inside an MRI machine.
“The Annoying Doctor”
(Season 6, Episode 21)
In this special season finale crossover episode, The Good Doctor himself arrives at Seattle Grace Mercy West Hospital and starts annoying everyone in sight. When Cristina attempts to kill him but botches the job, Meredith must go against her better judgment and save him.
“Sexual Healing”
(Season 6, Episode 3)
The hospital gets slapped with a lawsuit after a patient wakes during open heart surgery and catches all of the surgeons having sex in the storage closet."
https://theonion.com/the-best-and-worst-greys-anatomy-episodes-of-all-time/,The Best And Worst ‘Grey’s Anatomy’ Episodes Of All Time,Worst:,"“I’m Like A Bird”
(Season 8, Episode 1)
In an attempt at crossover appeal, the entire new crop of interns is made up of the 2013 Seattle Seahawks 53-man roster.
“A Hard Day’s Night”
(Season 1, Episode 1)
The new surgical intern’s first shift at the hospital reveals Sandra Oh is about to be trapped in this waste of a role for a decade of her life.
“Signs”
(Season 11, Episode 20)
Link treats an elderly puppeteer who may be the Zodiac killer, while Owen punches a CPR dummy. Meredith and Maggie huff nitrous oxide and play flashlight tag in the morgue.
“The Space You Needle”
(Season 9, Episode 12)
The doctors pay $40 each to go to the top of the Space Needle and realize Seattle is simply not that exciting of a city to see from above.
“Active Shooter, Again”
(Season 20, Episode 4)
Fans generally agree that the return of mass shooter Gary Clark, now as an unstoppable titanium cyborg rebuilt by rival Seattle Presbyterian Hospital, was a ratings gimmick at best.
“Pick One”
(Season 16, Episode 1 – Present)
Drop in on any random episode from the past six years and it’s a good bet it will be the worst one ever."
